source_name,author,title,description,url,published_at,content,cleaned_description,sentiment
NPR,Danny McArthur,These small Black-owned farms are growing crops with the climate in mind,"Across the Gulf South, small Black-owned farms are finding ways to use climate-friendly practices to grow crops while also addressing long-standing injustices.",https://www.npr.org/2024/09/12/nx-s1-5002077/small-black-owned-farms-climate-change-smart-agriculture,2024-09-12T10:00:00Z,"Climate change is affecting our food, and our food is affecting the climate. NPR is dedicating a week to stories and conversations about the search for solutions.
A number of small Black-owned farms… [+6629 chars]","across the gulf south, small black-owned farms are finding ways to use climate-friendly practices to grow crops while also addressing long-standing injustices.",Neutral
ABC News,Julia Jacobo,The debate proved that climate change is not at center of 2024 election: Experts,Climate change continues to remain on the backburner of the 2024 election following little mention of environmental policy during the first.,https://abcnews.go.com/US/presidential-debate-proved-climate-change-center-2024-election/story?id=113585193,2024-09-11T22:15:24Z,Climate change remains on the backburner of the 2024 election following little mention of environmental policy during the first -- and possibly only -- debate between the two presidential candidates.… [+5660 chars],climate change continues to remain on the backburner of the 2024 election following little mention of environmental policy during the first.,Neutral
Yahoo Entertainment,Reuters Videos,Belgian climate scientists grow the pears of the future,"STORY: A group of climate scientists in Belgium are currently exploring what the pears of the future might be like.""...the pears tend to be less firm and...",https://www.yahoo.com/news/belgian-climate-scientists-grow-pears-095044724.html,2024-09-25T09:50:44Z,"STORY: A group of climate scientists in Belgium are currently exploring what the pears of the future might be like.
""...the pears tend to be less firm and have more sugar.""
:: THIS EARTH
:: Maasme… [+2133 chars]","story: a group of climate scientists in belgium are currently exploring what the pears of the future might be like.""...the pears tend to be less firm and...",Neutral
ABC News,Julia Jacobo,How climate change is making Florida's Big Bend more vulnerable to tropical threats,Hurricane Helene is heading straight for one of the regions most vulnerable to the impact of hurricanes: Florida's Big Bend.,https://abcnews.go.com/US/hurricane-helene-climate-change-making-floridas-big-bend/story?id=114183293,2024-09-26T23:40:59Z,"Hurricane Helene is heading straight for one of the regions most vulnerable to hurricanes: Florida's Big Bend.
Helene is expected to make landfall as a dangerous major hurricane Thursday night near … [+5753 chars]",hurricane helene is heading straight for one of the regions most vulnerable to the impact of hurricanes: florida's big bend.,Neutral
Time,Rebecca Schneid,How the Climate Museum Hopes Art Will Spur Action,A day at the Climate Museum during New York City's Climate Week reveals how the exhibits  imbue viewers with agency to interact with art.,https://time.com/7024811/climate-museum-new-york-art-change/,2024-09-26T17:45:14Z,"The first piece of art attendees will see as they head to the Climate Museums latest exhibit is a map of the world in black, white, and gray.
At first glance, the map presents which countries are pr… [+5373 chars]",a day at the climate museum during new york city's climate week reveals how the exhibits  imbue viewers with agency to interact with art.,Neutral
Politicopro.com,"Scott Waldman, E&E News",Presidential Debate Features Fracking while Climate Change Is Mostly Ignored,Donald Trump all but ignored climate change at Tuesday’s presidential debate while Kamala Harris voiced support of both fossil fuels and increased clean energy spending,https://subscriber.politicopro.com/article/eenews/2024/09/11/harris-touts-climate-law-to-highlight-fracking-00178550,2024-09-11T16:15:00Z,"CLIMATEWIRE | Vice President Kamala Harris finally mentioned the climate law she has pointedly avoided on the campaign trail — to prove she won't ban fracking.
“I have not banned fracking as vice pr… [+4807 chars]",donald trump all but ignored climate change at tuesday’s presidential debate while kamala harris voiced support of both fossil fuels and increased clean energy spending,Positive
NPR,Kimberly Winston,A new kind of chaplain is helping people deal with 'climate grief',A new kind of spiritual advisor is rising among clergy trained in handling grief and other difficult emotions.,https://www.npr.org/2024/09/06/nx-s1-5092402/eco-chaplains-helping-people-deal-with-climate-grief,2024-09-06T09:51:00Z,"TALENT, Ore. When Diane Wares home state of Oregon proposed a natural gas pipeline that threatened local waterways, she sprang into action leading workshops on lobbying state lawmakers, mentoring stu… [+11722 chars]",a new kind of spiritual advisor is rising among clergy trained in handling grief and other difficult emotions.,Negative
NPR,Alejandra Borunda,These bakers want to make your bread tastier — with climate-resilient wheat,A team of scientists and bakers in the Pacific Northwest is searching for ways to make whole wheat bread resilient to a warming world — and more delicious.,https://www.npr.org/2024/09/09/nx-s1-5002074/bread-flour-climate-change,2024-09-10T10:00:00Z,"Climate change is affecting our food, and our food is affecting the climate. NPR is dedicating a week to stories and conversations about the search for solutions.
Its a drizzly, cold spring day outs… [+11702 chars]",a team of scientists and bakers in the pacific northwest is searching for ways to make whole wheat bread resilient to a warming world — and more delicious.,Neutral
Scientific American,Sherri Goodman,"We Must Secure Our Future in a Hotter, More Dangerous World",Defending the U.S. is much more complicated in an era of climate change,https://www.scientificamerican.com/article/we-must-secure-our-future-in-a-hotter-more-dangerous-world/,2024-09-09T11:00:00Z,"Flying by helicopter over the Greenland ice sheet, I am struck by its vast expanse of whiteness. But as I look closer I see that much of the ice is dotted with bright blue pools. These pools reflect … [+6016 chars]",defending the u.s. is much more complicated in an era of climate change,Neutral
NPR,Scott Neuman,Is getting food delivered worse for the climate? Sometimes it’s better,"From meal kits to grocery service to restaurant delivery, we look at the carbon footprint of convenient food and the choices people can make to try to reduce it. Sometimes there are trade-offs.",https://www.npr.org/2024/09/10/nx-s1-5020321/food-delivery-meal-kits-carbon-footprint,2024-09-11T10:00:00Z,"Climate change is affecting our food, and our food is affecting the climate. NPR is dedicating a week to stories and conversations about the search for solutions.
Theres a whiteboard on the refriger… [+9038 chars]","from meal kits to grocery service to restaurant delivery, we look at the carbon footprint of convenient food and the choices people can make to try to reduce it. sometimes there are trade-offs.",Neutral
Time,Rebecca Schneid,How Jacinda Ardern Sees Everyone as a Player in the Climate Fight,The former Prime Minister of New Zealand spoke about her “expectation bias” at the inaugural TIME100 Climate Leadership Forum.,https://time.com/7022329/climate-leadership-forum-jacinda-ardern-new-zealand-expectation-bias/,2024-09-24T03:00:00Z,"Jacinda Ardern, former Prime Minister of New Zealand, is prioritizing optimism in the movement to combat the climate crisisas well as expectation for leaders to do their jobs. If we resign ourselves … [+3863 chars]",the former prime minister of new zealand spoke about her “expectation bias” at the inaugural time100 climate leadership forum.,Neutral
Time,Harry Booth,Sasha Luccioni,"About 5 years ago, Sasha Luccioni was researching ways AI could help tackle climate change when a single question prompted her to rethink: What if AI was part of the problem? “Every time you do a Google search, you don’t know how much energy that’s using. Eve…",https://time.com/7012753/sasha-luccioni/,2024-09-05T11:24:03Z,"About 5 years ago, Sasha Luccioni was researching ways AI could help tackle climate change when a single question prompted her to rethink: What if AI was part of the problem? 
Every time you do a Go… [+1530 chars]","about 5 years ago, sasha luccioni was researching ways ai could help tackle climate change when a single question prompted her to rethink: what if ai was part of the problem? “every time you do a google search, you don’t know how much energy that’s using. eve…",Positive
The Atlantic,Karen Hao,Microsoft’s Hypocrisy on AI,Can artificial intelligence really enrich fossil-fuel companies and fight climate change at the same time? The tech giant says yes.,https://www.theatlantic.com/technology/archive/2024/09/microsoft-ai-oil-contracts/679804/,2024-09-13T10:00:00Z,"Microsoft executives have been thinking lately about the end of the world. In a white paper published late last year, Brad Smith, the company’s vice chair and president, and Melanie Nakagawa, its chi… [+16127 chars]",can artificial intelligence really enrich fossil-fuel companies and fight climate change at the same time? the tech giant says yes.,Negative
BBC News,NA,How the world’s smelliest fruit is making coffee more expensive,"A ""perfect storm"" of economic and environmental factors in coffee-producing regions is pushing up prices.",https://www.bbc.com/news/articles/c5y37dvlr70o,2024-09-15T02:33:23Z,"How much is too much for a caffeine fix?
Prices like £5 in London or $7 in New York for a cup of coffee may be unthinkable for some - but could soon be a reality thanks to a ""perfect storm"" of econo… [+5416 chars]","a ""perfect storm"" of economic and environmental factors in coffee-producing regions is pushing up prices.",Neutral
The New Yorker,Rebecca Mead,Can Your Stomach Handle a Meal at Alchemist?,"At the Copenhagen restaurant, diners are served raw jellyfish—and freeze-dried lamb brain served in a fake cranium—while videos about climate change swirl on the ceiling. Is it “gastronomic opera,” or sensory overload?",https://www.newyorker.com/magazine/2024/09/30/can-your-stomach-handle-a-meal-at-alchemist,2024-09-23T10:00:00Z,"Rasmus Munk, the celebrated Danish chef, has such memorable eyesthey are a piercing blue, and often bloodshotthat when a waiter at Alchemist, his restaurant in Copenhagen, served me an eyeball, I rec… [+17238 chars]","at the copenhagen restaurant, diners are served raw jellyfish—and freeze-dried lamb brain served in a fake cranium—while videos about climate change swirl on the ceiling. is it “gastronomic opera,” or sensory overload?",Negative
NPR,Rebecca Hersher,Abnormally warm water helped Helene rapidly intensify and suck up moisture,"Helene is dumping rain across the Southeast, after coming ashore as a powerful Category 4 storm. Abnormally warm water in the Gulf of Mexico helped it rapidly intensify and suck up moisture.",https://www.npr.org/2024/09/27/nx-s1-5130849/helene-category-4-fast-warm-water-climate-change,2024-09-27T16:01:46Z,"Follow NPR's live updates for the latest on the impact of Helene.
In the two days before it hit Florida, Hurricane Helene grew from a relatively weak tropical storm into a major Category 4 hurricane… [+1841 chars]","helene is dumping rain across the southeast, after coming ashore as a powerful category 4 storm. abnormally warm water in the gulf of mexico helped it rapidly intensify and suck up moisture.",Neutral
BBC News,NA,More than 80 dead in Vietnam super typhoon,The most powerful storm to hit the country in 30 years has also left thousands stranded.,https://www.bbc.com/news/articles/cql3qvg3vk9o,2024-09-10T10:14:53Z,"At least 82 people have now died in Vietnam as a super typhoon which hit on Saturday continues to bring heavy rainfall, landslides and flooding.
Thousands of people were seen stranded on rooftops in… [+1785 chars]",the most powerful storm to hit the country in 30 years has also left thousands stranded.,Positive
Time,Chantelle Lee and Rebecca Schneid,How Public and Private Sector Leaders Are Tackling Climate Equity,"EPA Administrator Michael S. Regan, RISE St. James CEO Sharon Lavigne, and Apple executive Lisa Jackson spoke during a panel at the TIME100 Climate Leadership Forum.",https://time.com/7022333/climate-leadership-forum-equity/,2024-09-24T04:30:00Z,"Sharon Lavigne knows first-hand the effects of climate change. At the inaugural TIME100 Climate Leadership Forum in New York City on Monday, the founder, director, and CEO of the faith-based grassroo… [+3296 chars]","epa administrator michael s. regan, rise st. james ceo sharon lavigne, and apple executive lisa jackson spoke during a panel at the time100 climate leadership forum.",Neutral
NPR,Nell Greenfieldboyce,Why the most climate-resistant glaciers are hiding in plain sight,"In the American West, white glaciers and snow fields are outnumbered by long-overlooked “rock glaciers.” The rock covering these vast hunks of ice makes them far less affected by warming temperatures.",https://www.npr.org/2024/09/30/nx-s1-5109050/climate-resistant-glaciers-hold-water-cooler-temperatues,2024-09-30T18:54:32Z,"In the Wasatch mountains near Salt Lake City, Utah, a popular hiking trail winds up through aspen and spruce trees to reach White Pine Lake.
Scott Hotaling is marching up this familiar path, but pas… [+7662 chars]","in the american west, white glaciers and snow fields are outnumbered by long-overlooked “rock glaciers.” the rock covering these vast hunks of ice makes them far less affected by warming temperatures.",Negative
CNN,"Laura Paddison, CNN",The controversial plan to turn a desert green,"A Dutch engineer wants to transform an expanse of arid land into green, fertile land teeming with wildlife — and in the process, change the weather",https://www.cnn.com/2024/09/08/climate/regreen-desert-sinai-egypt/index.html,2024-09-08T13:00:21Z,"Ties van der Hoevens ambitions are nothing if not grand. The Dutch engineer wants to transform a huge stretch of inhospitable desert into green, fertile land teeming with wildlife.
His sights are se… [+9912 chars]","a dutch engineer wants to transform an expanse of arid land into green, fertile land teeming with wildlife — and in the process, change the weather",Neutral
The Verge,Jennifer Pattison Tuohy,Sleep Number’s newest smart bed aims to tackle night sweats,The company says its newest smart bed can actively cool and adapt to both sleepers’ temperature needs throughout the night.,https://www.theverge.com/2024/10/1/24259440/sleep-number-climate-cool-smart-bed-price-features,2024-10-01T18:59:20Z,"Sleep Numbers newest smart bed aims to tackle night sweats
Sleep Numbers newest smart bed aims to tackle night sweats
 / The ClimateCool can actively cool you and adjust to your temperature through… [+3346 chars]",the company says its newest smart bed can actively cool and adapt to both sleepers’ temperature needs throughout the night.,Positive
Hacker News,NA,Autarc (YC S24) Is Hiring a Software Engineer to Fight Climate Change,Comments,https://news.ycombinator.com/item?id=41705391,2024-10-01T07:00:32Z,We're looking for a senior full-stack software engineer based in Germany who wants to directly tackle climate change by building a local-first React/CapacitorJS/TypeScript/RxDB/Supabase app.We're aut… [+657 chars],comments,Neutral
Gizmodo.com,Passant Rabie,Intense Flooding Expected as Florida Faces Possible Category 4 Hurricane Tonight,"Helene will make landfall Thursday evening, bringing about life-threatening conditions across the northwest coast.",https://gizmodo.com/intense-flooding-expected-as-florida-faces-possible-category-4-hurricane-tonight-2000503906,2024-09-26T19:53:01Z,"An unusually large storm is headed towards the coast of Florida, gaining strength as it travels along the Gulf of Mexico before it’s predicted to make landfall on Thursday evening.
Hurricane Helene … [+2758 chars]","helene will make landfall thursday evening, bringing about life-threatening conditions across the northwest coast.",Neutral
NPR,Julia Simon,Eating less beef is a climate solution. Here's why that's hard for some American men,"Climate researchers have long grappled with how to get Americans to eat less beef, a food with a huge global warming impact. Now some are thinking about it through the lens of gender.",https://www.npr.org/2024/09/14/nx-s1-5003066/beef-climate-change-american-men-masculinity,2024-09-15T11:00:00Z,"Climate change is affecting our food, and our food is affecting the climate. NPR is dedicating a week to stories and conversations about the search for solutions.
In 2006, when Malcolm Regisford was… [+19961 chars]","climate researchers have long grappled with how to get americans to eat less beef, a food with a huge global warming impact. now some are thinking about it through the lens of gender.",Positive
Yahoo Entertainment,NA,‘Short corn’ could replace the towering cornfields steamrolled by a changing climate,NA,https://consent.yahoo.com/v2/collectConsent?sessionId=1_cc-session_70f6852b-b22b-4816-a1bc-5f299af0e211,2024-09-23T14:01:39Z,"If you click 'Accept all', we and our partners, including 239 who are part of the IAB Transparency &amp; Consent Framework, will also store and/or access information on a device (in other words, use … [+678 chars]",NA,Neutral
Ars Technica,John Timmer,New study takes the Earth’s temperature over a half-billion years,"With one exception, a strong link between carbon dioxide and global temperatures.",https://arstechnica.com/science/2024/09/new-study-takes-the-earths-temperature-over-a-half-billion-years/,2024-09-20T15:24:51Z,"Enlarge/ The cycle of building and breaking up of supercontinents seems to drive long-term climate trends.
2
Global temperature records go back less than two centuries. But that doesn't mean we hav… [+4325 chars]","with one exception, a strong link between carbon dioxide and global temperatures.",Positive
BBC News,NA,Climate a more fundamental threat than terror - Lammy,Foreign Secretary David Lammy vows to put climate change at the heart of the UK's foreign policy.,https://www.bbc.com/news/articles/c62d477yg95o,2024-09-17T13:06:38Z,"The foreign secretary has said climate change is a more pervasive and fundamental threat than terrorism.
In his maiden speech, 100 days after taking office, David Lammy said the climate issue, along… [+4455 chars]",foreign secretary david lammy vows to put climate change at the heart of the uk's foreign policy.,Neutral
NPR,The NPR Network,Sustainable eating habits that can help the environment without taking over your life,What we eat plays a role in the health of our environment. Here are some things to consider when trying to make doable changes to improve your impact without breaking the bank.,https://www.npr.org/2024/09/12/g-s1-21786/sustainable-food-vegan-local,2024-09-12T12:00:00Z,"Climate change is affecting our food, and our food is affecting the climate. NPR is dedicating a week to stories and conversations about the search for solutions.
What we eat plays a role in the hea… [+5567 chars]",what we eat plays a role in the health of our environment. here are some things to consider when trying to make doable changes to improve your impact without breaking the bank.,Positive
NPR,Lauren Sommer,Climate change is coming for your wine,"In California's Napa Valley, the nation's unofficial wine capital, one varietal reigns supreme: cabernet sauvignon. But climate change is threatening the small blue-black grapes for which cabernet sauvignon is named. Increasingly severe heat waves are taking …",https://www.npr.org/2024/09/09/1198910728/heat-climate-change-wine,2024-09-09T07:00:59Z,"In hotter temperatures, cabernet grapes lose their rich red color and produce sweeter, more alcoholic wines.
Ryan Kellman/NPR
Climate change is affecting our food, and our food is affecting the cli… [+2127 chars]","in california's napa valley, the nation's unofficial wine capital, one varietal reigns supreme: cabernet sauvignon. but climate change is threatening the small blue-black grapes for which cabernet sauvignon is named. increasingly severe heat waves are taking …",Negative
Time,Justin Worland,The Market Signal Sent By Trump and Harris on Climate During the Debate,"The debate offered an opportunity to evaluate where climate policy under Trump or Harris, and, to an extent, the market may be going.",https://time.com/7020975/the-market-signal-sent-by-trump-and-harris-on-climate-during-the-debate/,2024-09-13T16:04:57Z,"(To get this story in your inbox, subscribe to the TIME CO2 Leadership Report newsletter here.)
When President Biden entered the White House in 2021, before his administration had written any new re… [+4282 chars]","the debate offered an opportunity to evaluate where climate policy under trump or harris, and, to an extent, the market may be going.",Positive
Time,Ayana Elizabeth Johnson,How We Can Move Away From the Climate Brink,Ayana Elizabeth Johnson explores what climate success could look like—if only we let it.,https://time.com/7021972/climate-future-ayana-elizabeth-johnson-essay/,2024-09-17T15:44:20Z,"It will take momentous shifts to ensure a reasonably safe climate future. How can we find the wherewithal and endurance to transform our energy, food, and transportation systems; our buildings, infra… [+14169 chars]",ayana elizabeth johnson explores what climate success could look like—if only we let it.,Positive
CNET,Erin Gobler,How to Protect Your Home During Hurricanes and Other Major Storms,Hurricanes may be getting stronger due to climate change. We'll show you how to keep yourself and your home safe.,https://www.cnet.com/home/energy-and-utilities/how-to-protect-your-home-during-hurricanes-and-other-major-storms/,2024-09-25T21:00:07Z,"Though we're nearing the end of hurricane season for the East Coast of the US, an August report from the National Oceanic and Atmospheric Administration predicted four to seven more hurricanes for th… [+5735 chars]",hurricanes may be getting stronger due to climate change. we'll show you how to keep yourself and your home safe.,Positive
Yahoo Entertainment,SETH BORENSTEIN,Pollution of the potent warming gas methane soars and people are mostly to blame,"The amount and proportion of the powerful heat-trapping gas methane that humans spew into the atmosphere is rising, helping to turbocharge climate change, a ...",https://www.yahoo.com/news/pollution-potent-warming-gas-methane-075627841.html,2024-09-10T07:56:27Z,"The amount and proportion of the powerful heat-trapping gas methane that humans spew into the atmosphere is rising, helping to turbocharge climate change, a new study finds.
Tuesdays study finds tha… [+4333 chars]","the amount and proportion of the powerful heat-trapping gas methane that humans spew into the atmosphere is rising, helping to turbocharge climate change, a ...",Positive
NPR,Rebecca Hersher,"He survived the water, but not the flood","Climate-driven flooding destroyed Tony Calhoun’s home in 2022. But as the water receded, his despair only grew. Now, his family hopes to bring attention to the mental health toll of extreme weather.",https://www.npr.org/2024/09/17/nx-s1-5051826/remembering-kentucky-flood-victim-tony-calhoun,2024-09-17T09:00:00Z,"If you or someone you know is in crisis, please call, text or chat with the Suicide and Crisis Lifeline at 988.
Tony Calhoun was unique. Anyone who knew him would tell you that.
On one hand, there … [+9303 chars]","climate-driven flooding destroyed tony calhoun’s home in 2022. but as the water receded, his despair only grew. now, his family hopes to bring attention to the mental health toll of extreme weather.",Negative
BBC News,NA,Myanmar hit by deadly floods after Typhoon Yagi,"Myanmar's ruling junta has requested foreign aid as large areas are inundated, state-run media report.",https://www.bbc.com/news/articles/ckgn1yrkyppo,2024-09-14T04:55:07Z,"Severe flooding has hit Myanmar after Typhoon Yagi, with more than 230,000 people forced to flee their homes, according to officials.
The country's ruling junta has requested foreign aid to mitigate… [+2028 chars]","myanmar's ruling junta has requested foreign aid as large areas are inundated, state-run media report.",Neutral
Yahoo Entertainment,NA,Midwest is gearing up for water fights fueled by climate change,NA,https://consent.yahoo.com/v2/collectConsent?sessionId=1_cc-session_5c29b2b9-ffa4-4350-8b1e-db081f1475ef,2024-09-02T11:00:00Z,"If you click 'Accept all', we and our partners, including 238 who are part of the IAB Transparency &amp; Consent Framework, will also store and/or access information on a device (in other words, use … [+678 chars]",NA,Neutral
Yahoo Entertainment,RICK BOWMER and MARK THIESSEN,Climate change destroyed an Alaska village. Its residents are starting over in a new town,"Growing up along the banks of the Ninglick River in western Alaska, Ashley Tom would look out of her window after strong storms from the Bering Sea hit her...",https://www.yahoo.com/news/climate-change-destroyed-alaska-village-133728537.html,2024-09-26T13:37:28Z,"MERTARVIK, Alaska (AP) Growing up along the banks of the Ninglick River in western Alaska, Ashley Tom would look out of her window after strong storms from the Bering Sea hit her village and notice s… [+8385 chars]","growing up along the banks of the ninglick river in western alaska, ashley tom would look out of her window after strong storms from the bering sea hit her...",Positive
