source_name,author,title,description,url,published_at,content,cleaned_description,sentiment
BBC News,NA,King to attend barbecue and meet PM on Australia trip,The King will travel to Australia on his biggest trip overseas since he began treatment for cancer.,https://www.bbc.com/news/articles/cp35en2971go,2024-09-10T15:22:24Z,"King Charles III and Queen Camilla will sample a traditional barbecue, along with more formal ceremonial engagements, when they visit Australia next month.
The trip will be the King's biggest overse… [+2167 chars]",the king will travel to australia on his biggest trip overseas since he began treatment for cancer.,Neutral
Science Daily,NA,Report exposes worsening health threats of climate change in UK,"A new report has revealed the wide-ranging and increasing health dangers posed by long-term weather extremes in the UK, as the effects of climate change deepen.",https://www.sciencedaily.com/releases/2024/09/240905143559.htm,2024-09-05T18:35:59Z,"A new report has revealed for the first time the wide-ranging and increasing health dangers posed by long-term weather extremes in the UK, as the effects of climate change deepen.The review, publishe… [+3330 chars]","a new report has revealed the wide-ranging and increasing health dangers posed by long-term weather extremes in the uk, as the effects of climate change deepen.",Neutral
Yahoo Entertainment,Rod Gilmour,'All politicians should be forced into space to see Earth's beauty',"Rachel Delacour is founder of climate tech firm Sweep. She sold her first company, BIME Analytics,  for $45m in 2015.",https://uk.finance.yahoo.com/news/climate-tech-sweep-environment-050004481.html,2024-09-13T05:00:04Z,"Co-founder Rachel Delacour decided to pour all her energy into building carbon management software.
Rachel Delacour is founder of climate tech firm Sweep, which works with brands including LOreal (L… [+4318 chars]","rachel delacour is founder of climate tech firm sweep. she sold her first company, bime analytics,  for $45m in 2015.",Neutral
NPR,The NPR Network,Creative ways communities are reducing food waste,"While lots of powerful changes to reduce food waste can start at home, sometimes the scale of the problem benefits from a community-wide approach.",https://www.npr.org/2024/09/15/g-s1-20752/compost-food-waste-community,2024-09-15T14:00:00Z,"Climate change is affecting our food, and our food is affecting the climate. NPR is dedicating a week to stories and conversations about the search for solutions.
When we started working on this yea… [+4024 chars]","while lots of powerful changes to reduce food waste can start at home, sometimes the scale of the problem benefits from a community-wide approach.",Positive
Undark Magazine,Undark Magazine,The Golden Age of offbeat Arctic research,The Cold War spawned some odd military projects that were doomed to fail.,https://undark.org/2024/09/06/wilo-golden-age-offbeat-arctic-research/,2024-09-08T11:12:24Z,"Enlarge/ At the US Armys Camp Century on the Greenland ice sheet, an Army truck equipped with a railroad wheel conversion rides on 1,300 feet of track under the snow.
2
In recent years, the Arctic … [+3369 chars]",the cold war spawned some odd military projects that were doomed to fail.,Negative
The Atlantic,Zoë Schlanger,The Climate Question the Next President Will Have to Answer,How will they help Americans deal with the extreme weather battering the country?,https://www.theatlantic.com/science/archive/2024/09/trump-harris-debate-climate-change/679778/,2024-09-11T03:50:17Z,"Tonight’s presidential debate was held while wildfires rage in Nevada, Southern California, Oregon, and Idaho. Louisiana is bracing for a possible hurricane landfall. After a year of floods and storm… [+6862 chars]",how will they help americans deal with the extreme weather battering the country?,Positive
Time,Harry Booth and Video by Joey Lautrup,Cities Are on the Front Line of the ‘Climate-Health Crisis.’ A New Report Provides a Framework for Tackling Its Effects,"Less than a third of cities have a resilience plan that integrates climate and health, a Rockefeller Foundation found. It highlights success stories that could show a path forward.",https://time.com/7024639/cities-climate-health/,2024-09-26T16:00:53Z,"The World Health Organization (WHO) estimates that extreme heat kills almost half a million people each yearmore than war, terrorism and malnutrition combined. That number is likely to rise as the cl… [+10261 chars]","less than a third of cities have a resilience plan that integrates climate and health, a rockefeller foundation found. it highlights success stories that could show a path forward.",Positive
Science Daily,NA,Thinking about the future: Examining the exacerbating and attenuating factors of despair-induced climate burnout,New research explored the exacerbating and attenuating factors of despair-induced climate burnout to learn how people can overcome despair and maintain motivation to fight climate change.,https://www.sciencedaily.com/releases/2024/09/240925123634.htm,2024-09-25T16:36:34Z,"As the occurrence of weather extremes continues to escalate, the climate change movement now grapples with a new challenge, 'climate burnout'.The troubling trend of despair and fatigue among those wh… [+2762 chars]",new research explored the exacerbating and attenuating factors of despair-induced climate burnout to learn how people can overcome despair and maintain motivation to fight climate change.,Negative
NPR,The NPR Network,Not sure what to make for dinner? Here are recipes to help you eat sustainably,"Finding meals that are good for you, your wallet and the environment can be difficult. We've pulled together a few recipes to make sustainable choices even easier.",https://www.npr.org/2024/09/15/g-s1-21888/recipes-seasonal-plant-based,2024-09-15T14:00:00Z,"Climate change is affecting our food, and our food is affecting the climate. NPR is dedicating a week to stories and conversations about the search for solutions.
Deciding what to make for dinner ca… [+2254 chars]","finding meals that are good for you, your wallet and the environment can be difficult. we've pulled together a few recipes to make sustainable choices even easier.",Positive
Slashdot.org,msmash,Europe's Farming Lobbies Recognize Need To Eat Less Meat in Shared Vision Report,"Europe's food and farming lobbies have recognized the need to eat less meat after hammering out a shared vision for the future of agriculture with green groups and other stakeholders. From a report: The wide-ranging report calls for ""urgent, ambitious and fea…",https://news.slashdot.org/story/24/09/04/1449256/europes-farming-lobbies-recognize-need-to-eat-less-meat-in-shared-vision-report,2024-09-04T15:25:00Z,"The wide-ranging report calls for ""urgent, ambitious and feasible"" change in farm and food systems and acknowledges that Europeans eat more animal protein than scientists recommend. It says support i… [+1400 chars]","europe's food and farming lobbies have recognized the need to eat less meat after hammering out a shared vision for the future of agriculture with green groups and other stakeholders. from a report: the wide-ranging report calls for ""urgent, ambitious and fea…",Positive
Gizmodo.com,Adam Kovac,The Surprising Ingredient That Helped Polynesians Conquer the Pacific,"Ancient Polynesians were encouraged to settle new territories because they had a reliable and hardy crop, new research suggests.",https://gizmodo.com/the-surprising-ingredient-that-helped-polynesians-conquer-the-pacific-2000503199,2024-09-25T23:01:34Z,"Sweet potatoes are a very versatile tuber. You can roast them. You can bake them into a pie. You can turn them into the third best type of french fry. And apparently, you can make them an integral pa… [+2849 chars]","ancient polynesians were encouraged to settle new territories because they had a reliable and hardy crop, new research suggests.",Positive
Gizmodo.com,Adam Kovac,Earth Mysteriously Shook for 9 Days Last Year. Scientists Finally Know What Happened.,"The strange, imperceptible tremor mystified geologists, but a vast team of researchers says it has cracked the case.",https://gizmodo.com/earth-mysteriously-shook-for-9-days-last-year-scientists-finally-know-what-happened-2000498258,2024-09-13T14:05:52Z,"For over a week in 2023, the planet got the shakes and nobody knew why. Now, geologists believe a fjord in Greenland is to blame for the odd seismological event.
You likely didnt notice the quaverin… [+2814 chars]","the strange, imperceptible tremor mystified geologists, but a vast team of researchers says it has cracked the case.",Neutral
Gizmodo.com,James Whitbrook,Lego Promises It’s Keeping Physical Instructions After Survey Backlash,A customer survey suggesting a move to digital-only building instructions was pulled earlier this week after fan fury.,https://gizmodo.com/lego-digital-instructions-survey-backlash-2000501405,2024-09-20T16:27:02Z,"In recent years Lego has made strides to try and mitigate the impact of its plastic brick empire on the planet, from attempts at making its bricks more environmentally friendly, to slowly bringing in… [+3123 chars]",a customer survey suggesting a move to digital-only building instructions was pulled earlier this week after fan fury.,Positive
Gizmodo.com,Adam Kovac,New Map Shows Where You’re Most Likely to Encounter Landslides in the US,"Bad news if you're on the West Coast, Alaska, or Puerto Rico. Great news if you live in Florida.",https://gizmodo.com/new-map-shows-where-youre-most-likely-to-encounter-landslides-in-the-us-2000498027,2024-09-12T15:55:00Z,"If you see your reflection in the snow covered hills, it might be time to check out a new map from the United States Geological Survey. The map reveals that a surprisingly large part of the country i… [+3449 chars]","bad news if you're on the west coast, alaska, or puerto rico. great news if you live in florida.",Neutral
The Conversation Africa,"Kyle Hilburn, The Conversation",How Wildfires Create Rain and Change the Weather,"Because wildfires create their own wind patterns, they can also spawn their own weather. Here’s how it works",https://theconversation.com/wildfires-can-create-their-own-weather-including-thunderstorms-and-tornado-like-fire-whirls-an-atmospheric-scientist-explains-how-235845,2024-09-09T19:10:00Z,"The following essay is reprinted with permission from The Conversation, an online publication covering the latest research.Wildfire blowups, fire whirls, towering thunderstorms: When fires get large … [+5292 chars]","because wildfires create their own wind patterns, they can also spawn their own weather. here’s how it works",Neutral
BBC News,NA,Smear campaign against celebrity-endorsed nature reserve exposed,How did a Philippine nature reserve get caught up in an information battle?,https://www.bbc.com/news/articles/cp39zvv6kl4o,2024-09-28T00:18:25Z,"A nature reserve in the Philippines, which has been lauded by top climate activists and film stars, has come under a concerted disinformation attack on social media as it fights to continue its work,… [+7624 chars]",how did a philippine nature reserve get caught up in an information battle?,Neutral
Futurity: Research News,James Devitt-NYU,Patriotic messages can boost support for climate change action,"Framing climate action as patriotic and status-quo friendly increases liberals' and conservatives' belief in climate change, research finds.",https://www.futurity.org/climate-change-action-patriotic-liberals-conservatives-3248752/,2024-09-16T18:19:35Z,A new study shows that framing the need to address climate change as patriotic and as necessary to preserve the American “way of life” can increase belief in climate change and support for pro-enviro… [+4004 chars],"framing climate action as patriotic and status-quo friendly increases liberals' and conservatives' belief in climate change, research finds.",Positive
BBC News,NA,Mine water could heat thousands of Welsh homes,Energy bills could be cut by low carbon heat schemes which use water from abandoned Welsh coal mines.,https://www.bbc.com/news/articles/c0l867k70p8o,2024-09-10T22:00:10Z,"Mine water at the former Six Bells colliery in Abertillery is pumped 40m [131ft] to the surface where it is cleaned and treated
Energy bills could be cut by low carbon heat schemes which use water f… [+4222 chars]",energy bills could be cut by low carbon heat schemes which use water from abandoned welsh coal mines.,Negative
Slashdot.org,BeauHD,Pacific Islands Submit Court Proposal For Recognition of Ecocide As a Crime,"Vanuatu, Fiji, and Samoa have proposed a change to the International Criminal Court (ICC) to recognize ecocide as a crime, allowing for the prosecution of individuals responsible for significant environmental harm. If successful, the change would recognize ec…",https://yro.slashdot.org/story/24/09/09/239227/pacific-islands-submit-court-proposal-for-recognition-of-ecocide-as-a-crime,2024-09-10T01:25:00Z,"Vanuatu, Fiji and Samoa have proposed a formal recognition by the court of the crime of ecocide, defined as ""unlawful or wanton acts committed with knowledge that there is a substantial likelihood of… [+1987 chars]","vanuatu, fiji, and samoa have proposed a change to the international criminal court (icc) to recognize ecocide as a crime, allowing for the prosecution of individuals responsible for significant environmental harm. if successful, the change would recognize ec…",Negative
Abduzeedo.com,abduzeedo,7Analytics: Data-Driven Branding for Climate Solutions,"7Analytics: Data-Driven Branding for Climate Solutions
 


 abduzeedo0918—24

 Discover how Studio Oker crafted a data-inspired branding and visual identity for 7Analytics, a climate tech leader. Explore the fusion of design and data visualization.

Studio O…",https://abduzeedo.com/node/88607,2024-09-18T16:03:44Z,"Discover how Studio Oker crafted a data-inspired branding and visual identity for 7Analytics, a climate tech leader. Explore the fusion of design and data visualization.
Studio Oker's recent collabo… [+1977 chars]","7analytics: data-driven branding for climate solutions
 


 abduzeedo0918—24

 discover how studio oker crafted a data-inspired branding and visual identity for 7analytics, a climate tech leader. explore the fusion of design and data visualization.

studio o…",Positive
Science Daily,NA,"Climate change likely to increase diarrheal disease hospitalizations by 2100s in Dhaka, Bangladesh","By 2100, hospitalizations from diarrheal diseases are predicted to increase in the city of Dhaka in Bangladesh as a result of climate change, even if global warming stays under 2 degrees Celsius, according to a new study.",https://www.sciencedaily.com/releases/2024/09/240926144844.htm,2024-09-26T18:48:44Z,"By 2100, hospitalizations from diarrheal diseases are predicted to increase in the city of Dhaka in Bangladesh as a result of climate change, even if global warming stays under 2 degrees Celsius. Far… [+2070 chars]","by 2100, hospitalizations from diarrheal diseases are predicted to increase in the city of dhaka in bangladesh as a result of climate change, even if global warming stays under 2 degrees celsius, according to a new study.",Positive
Science Daily,NA,One in two El Niño events could be extreme by mid-century,"Climate change from greenhouse gas emissions could make extreme El Nino events more frequent, according to new research.",https://www.sciencedaily.com/releases/2024/09/240925123647.htm,2024-09-25T16:36:47Z,"With the climate pattern known as El Niño in full force from mid-2023 to mid-2024, global temperatures broke records for 12 months in a row. As one of the strongest El Niño events on record, it was l… [+4839 chars]","climate change from greenhouse gas emissions could make extreme el nino events more frequent, according to new research.",Neutral
Android Central,tips@androidcentral.com (Nickolas Diaz),Google could show leniency with the Pixel Watch's lack of repairability,A report surfaced following a Google representative's statement about the Pixel Watch's repairability.,https://www.androidcentral.com/wearables/google-repairability-leniency-pixel-watch-report,2024-09-25T19:12:03Z,"What you need to know
<ul><li>A report following a Climate Week NYC panel details a Google representative's words about bringing repairability to the Pixel Watch.</li><li>Their statement noted how G… [+3008 chars]",a report surfaced following a google representative's statement about the pixel watch's repairability.,Neutral
New Scientist,Madeleine Cuff,Weather forecasts could warn about events made worse by climate change,"Thanks to advances in weather simulation, forecasts of heatwaves and hurricanes could soon come with information about the extent to which they were fuelled by climate change",https://www.newscientist.com/article/2447643-weather-forecasts-could-warn-about-events-made-worse-by-climate-change/,2024-09-13T10:00:57Z,"A new kind of weather forecast could tell us beforehand whether extreme events, like the 2018 Hurricane Florence, were made worse by climate change
Nathan Congleton/NBCU Photo Bank/NBCUniversal via … [+446 chars]","thanks to advances in weather simulation, forecasts of heatwaves and hurricanes could soon come with information about the extent to which they were fuelled by climate change",Positive
NPR,Kayla Desroches,Citizen scientists are hunting moths in Montana for climate change studies,"Insects are great indicators of climate change because they’re the first animals to leave when temperatures change. But a lot about them remains unknown, citizen scientists are helping change that.",https://www.npr.org/2024/09/11/nx-s1-5100892/citizen-scientists-are-hunting-moths-in-montana-for-climate-change-studies,2024-09-11T21:49:44Z,"Insects are great indicators of climate change because theyre the first animals to leave when temperatures change. But a lot about them remains unknown, citizen scientists are helping change that.","insects are great indicators of climate change because they’re the first animals to leave when temperatures change. but a lot about them remains unknown, citizen scientists are helping change that.",Positive
Time,Chantelle Lee,The Clean Energy Transition Is Already Underway,Energy Secretary Jennifer M. Granholm spoke with International Energy Agency executive director Faith Birol and Iberdrola executive chairman Ignacio Galán during a panel at the inaugural TIME100 Climate Leadership Forum.,https://time.com/7022326/climate-leadership-forum-green-economy-clean-energy-transition/,2024-09-24T03:00:00Z,"Three experts in the energy sector spoke about the progress and future of transitioning to clean energy at a panel, moderated by TIME senior correspondent Justin Worland, at the inaugural TIME100 Cli… [+2773 chars]",energy secretary jennifer m. granholm spoke with international energy agency executive director faith birol and iberdrola executive chairman ignacio galán during a panel at the inaugural time100 climate leadership forum.,Positive
