source_name,author,title,description,url,published_at,content,cleaned_description,sentiment
Wired,Grace Browne,The Multiple Ways Climate Change Threatens to Make Migraines Worse,"Migraine sufferers are often triggered by the weather, and research suggests warming temperatures and more extreme weather events worsen attacks.",https://www.wired.com/story/climate-change-could-make-migraines-worse/,2024-09-20T09:00:00Z,"Migraines have long had an intimate relationship with the elements. Alongside stress and hormones, fluctuations in meteorological conditions are one of the most commonly cited triggers for an attack.… [+3310 chars]","migraine sufferers are often triggered by the weather, and research suggests warming temperatures and more extreme weather events worsen attacks.",Negative
Wired,Dennis Mersereau,Why Super Typhoons Like Yagi Are More Common Than You’d Think,"Unlike in the Atlantic, there is little to stop high-intensity storms forming in Southeast Asia, and climate change is making conditions even more perilous.",https://www.wired.com/story/why-super-typhoons-like-yagi-are-more-common-than-youd-think/,2024-09-05T21:32:54Z,"The years first super typhoon erupted over the steamy waters of the western Pacific Ocean on Thursday as Yagi churned toward an eventual landfall in southern China.
Having formed as a tropical cyclo… [+1743 chars]","unlike in the atlantic, there is little to stop high-intensity storms forming in southeast asia, and climate change is making conditions even more perilous.",Negative
Wired,Chris Baraniuk,The Cost of Lightning,"Exactly how climate change will impact lightning isn’t clear, but governments, public bodies, and the military are prepping for stormier weather.",https://www.wired.com/story/lightning-protection-damage-climate-change-extreme-weather/,2024-09-11T11:30:00Z,It was the terrible prospect of lightning one day striking the historic windmill that troubled Andrew Farrell. A bolt five times hotter than the surface of the sun instantly turning moisture in one o… [+3260 chars],"exactly how climate change will impact lightning isn’t clear, but governments, public bodies, and the military are prepping for stormier weather.",Neutral
Wired,Will Knight,The United Nations Wants to Treat AI With the Same Urgency as Climate Change,A UN report proposes that the organization take a much more active role in the monitoring and oversight of AI.,https://www.wired.com/story/united-nations-artificial-intelligence-report/,2024-09-19T05:00:00Z,"A United Nations report released today proposes having the international body oversee the first truly global effort for monitoring and governing artificial intelligence.
The report, produced by the … [+3067 chars]",a un report proposes that the organization take a much more active role in the monitoring and oversight of ai.,Positive
BBC News,NA,Europe’s deadly floods are glimpse of future climate,A new study shows that the record-breaking rainfall was made more likely and intense by climate change.,https://www.bbc.com/news/articles/cn5zx2zx5xvo,2024-09-25T03:06:20Z,"Local residents rescue a woman from rising flood waters in the Romanian village of Slobozia Conachi
Central Europe's devastating floods were made much worse by climate change and offer a stark glimp… [+5380 chars]",a new study shows that the record-breaking rainfall was made more likely and intense by climate change.,Positive
BBC News,NA,Somalia: From Crisis to Renewal,"Climate change in Somalia is acting as a kind of 'chaos multiplier', making existing conflicts even more acute. So how is the country rising to the challenge?",https://www.bbc.co.uk/iplayer/episode/m0023bvd/somalia-from-crisis-to-renewal,2024-09-17T23:01:00Z,"Climate change in Somalia is acting as a kind of 'chaos multiplier', making existing conflicts even more acute. So how is the country rising to the challenge? More","climate change in somalia is acting as a kind of 'chaos multiplier', making existing conflicts even more acute. so how is the country rising to the challenge?",Neutral
Gizmodo.com,Rose Pastore,Kamala Harris’s Patriotic Spin on Climate Action,A study suggests that framing the issue in terms of American values holds promise.,https://gizmodo.com/kamala-harriss-patriotic-spin-on-climate-action-2000498462,2024-09-13T13:45:56Z,"This story was originally published by Grist. Sign up for Grist’s weekly newsletter here.
Freedom is often a Republican talking point, but Vice President Kamala Harris is trying to reclaim the conce… [+5869 chars]",a study suggests that framing the issue in terms of american values holds promise.,Neutral
Ars Technica,Howard Lee,How did volcanism trigger climate change before the eruptions started?,New dating of a major ancient warming shows warming started before major eruptions.,https://arstechnica.com/science/2024/09/how-did-volcanism-trigger-climate-change-before-the-eruptions-started/,2024-09-08T11:00:53Z,"Enlarge/ Loads of lava: Kasbohm with a few solidified lava flows of the Columbia River Basalts.
3
As our climate warms beyond its historical range, scientists increasingly need to study climates de… [+4030 chars]",new dating of a major ancient warming shows warming started before major eruptions.,Neutral
Wired,Richard Schiffman,Breadfruit Is Here to Save the World,"This calorie-rich, nutrient-dense, and climate-resilient crop has the power to step in for more common staples that can’t handle global warming.",https://www.wired.com/story/breadfruit-caribbean-pacific-climate-change-super-food/,2024-09-11T11:00:00Z,"Warming temperatures are making farming much more difficult in the tropics. Food systems across island nations in the Caribbean and Pacific are particularly vulnerable, being hit hard by a combinatio… [+3131 chars]","this calorie-rich, nutrient-dense, and climate-resilient crop has the power to step in for more common staples that can’t handle global warming.",Neutral
The Verge,Justine Calma,Summer 2024 is already the hottest on record,"Heat has been record-breaking this summer, and it’s not over yet.",https://www.theverge.com/2024/9/6/24237451/summer-2024-is-already-the-hottest-on-record,2024-09-06T15:38:38Z,"Spectators and cyclists during a heatwave coinciding with the Paris Olympics on August 4th, 2024. | Photo by Magali Cohen / Hans Lucas / AFP via Getty Images

 

 The Northern Hemisphere just experi… [+2862 chars]","heat has been record-breaking this summer, and it’s not over yet.",Neutral
InsideClimate News,Inside Climate News,Droughts likely to be even longer in the future due to climate change,Major climate reports may be underselling the risks of rising emissions.,https://insideclimatenews.org/news/18092024/major-climate-reports-may-be-underestimating-drought-flood-risks/,2024-09-19T13:56:02Z,"32
Droughts in the coming decades could be longer than projected by current climate models, a new study published Wednesday in Nature warns.
The international team of scientists examined potential … [+3356 chars]",major climate reports may be underselling the risks of rising emissions.,Negative
NPR,The NPR Network,Hungry for new podcasts? Here are 8 episodes about how climate change affects our food,"Add these episodes to your listening rotation during the NPR Network's Climate Solutions Week, where we're dedicated to stories and conversations about the search for climate solutions.",https://www.npr.org/2024/09/09/g-s1-20267/best-podcasts-food-climate,2024-09-09T18:00:00Z,"Climate change is affecting our food, and our food is affecting the climate. NPR is dedicating a week to stories and conversations about the search for solutions.
Looking for solutions to our food n… [+3893 chars]","add these episodes to your listening rotation during the npr network's climate solutions week, where we're dedicated to stories and conversations about the search for climate solutions.",Positive
Gizmodo.com,Lucas Ropek,Judge Throws the Book at Climate Activists Who Threw Soup on Van Gogh Painting,"Tossing a can of soup at a priceless work of art will get you time in the slammer, apparently.",https://gizmodo.com/judge-throws-the-book-at-climate-activists-who-threw-soup-on-van-gogh-painting-2000504504,2024-09-27T20:30:17Z,"The two environmental activists who threw a can of tomato soup on Vincent Van Gogh’s “Sunflowers” painting have been sentenced to two years in prison.
In October of 2022, Phoebe Plummer, then 21, an… [+2699 chars]","tossing a can of soup at a priceless work of art will get you time in the slammer, apparently.",Neutral
NPR,NPR,Climate Solutions Week: The future of food,"Climate change is affecting our food, and our food is affecting the climate. NPR is dedicating a week to stories and conversations about the search for solutions, from how we farm to what we cook to reducing food waste.",https://www.npr.org/2024/09/06/g-s1-19303/food-climate-solutions,2024-09-06T16:48:31Z,"September 9-15, 2024
Climate experts say when it comes to global warming, pay attention to what we eat. Food and agriculture make up more than 25% of the pollution that heats our planet. What's driv… [+789 chars]","climate change is affecting our food, and our food is affecting the climate. npr is dedicating a week to stories and conversations about the search for solutions, from how we farm to what we cook to reducing food waste.",Neutral
Business Insider,Catherine Boudreau,Climate crisis is helping spread deadly mosquito viruses in the US,Mosquito-borne illnesses like triple E and West Nile are rising due to climate change and travel.,https://www.businessinsider.com/west-nile-triple-e-mosquito-virus-diseases-us-2024-9,2024-09-05T13:35:50Z,"Multiple mosquito-borne illnesses are on the rise in the US, including triple E and West Nile.Soumyabrata Roy/Getty Images.
<ul><li>Mosquito-borne illnesses are rising in the US, including triple E,… [+3158 chars]",mosquito-borne illnesses like triple e and west nile are rising due to climate change and travel.,Neutral
NPR,Brittney Melton,"Harris and Trump’s post-debate plans. And, why climate change puts chocolate at risk","Former President Donald Trump and Vice President Harris are campaigning in swing states heavily post their first presidential debate. And, why climate change could put chocolate in danger.",https://www.npr.org/2024/09/13/g-s1-22506/up-first-newsletter-harris-trump-campaign-swing-states-climate-change-chocolate,2024-09-13T12:05:15Z,"Good morning. You're reading the Up First newsletter. Subscribe here to get it delivered to your inbox, and listen to the Up First podcast for all the news you need to start your day.
Today's top st… [+6113 chars]","former president donald trump and vice president harris are campaigning in swing states heavily post their first presidential debate. and, why climate change could put chocolate in danger.",Neutral
Harvard Business Review,"Solitaire Townsend, Kaya Axelsson","To Incentivize Companies to Address Climate Change, Measure Their Broader Impact","Current climate reporting focuses primarily on reducing carbon emissions within companies’ direct operations and value chains, often overlooking the broader impact businesses can have on society. This narrow approach fails to recognize or reward companies for…",https://hbr.org/2024/09/to-incentivize-companies-to-address-climate-change-measure-their-broader-impact,2024-09-06T14:00:00Z,"Current climate reporting focuses primarily on reducing carbon emissions within companies’ direct operations and value chains, often overlooking the broader impact businesses can have on society. Thi… [+654 chars]","current climate reporting focuses primarily on reducing carbon emissions within companies’ direct operations and value chains, often overlooking the broader impact businesses can have on society. this narrow approach fails to recognize or reward companies for…",Neutral
NPR,The NPR Network,How we grow food affects the climate. Here are solutions communities are taking to help,We've gathered examples from across the NPR Network of how we can change the food we grow to support climate goals.,https://www.npr.org/2024/09/14/g-s1-22158/climate-food-farming-solution,2024-09-14T18:00:00Z,"Climate change is affecting our food, and our food is affecting the climate. NPR is dedicating a week to stories and conversations about the search for solutions.
As NPR's climate solutions reporter… [+4249 chars]",we've gathered examples from across the npr network of how we can change the food we grow to support climate goals.,Positive
NPR,Manola Secaira,California farmers turn to agave amid drought conditions and climate change,Farmers in California are trying to plant crops that don't require a lot of water. Some are turning to growing agave as a response to a warming state.,https://www.npr.org/2024/09/06/nx-s1-5002056/california-farmers-agave-drought-conditions-climate-change,2024-09-09T10:00:00Z,"Climate change is affecting our food, and our food is affecting the climate. NPR is dedicating a week to stories and conversations about the search for solutions.
Most of the United States' fruits a… [+12610 chars]",farmers in california are trying to plant crops that don't require a lot of water. some are turning to growing agave as a response to a warming state.,Positive
NPR,Bill Chappell,"A landslide linked to climate change ‘rang’ the Earth for 9 days, researchers say","The scale of the geological event is like something from prehistoric times, with a tsunami 200 meters--656 feet--in height. But it happened last year. Researchers warn that similar events may reoccur.",https://www.npr.org/2024/09/13/g-s1-22858/a-landslide-linked-to-climate-change-rang-the-earth-for-9-days-researchers-say,2024-09-13T21:31:30Z,"The global seismic signal was extremely unusual, and it resonated for more than a week. So its no surprise that it grabbed the attention of researchers around the world. In the end, it took 68 expert… [+3233 chars]","the scale of the geological event is like something from prehistoric times, with a tsunami 200 meters--656 feet--in height. but it happened last year. researchers warn that similar events may reoccur.",Neutral
NPR,Anna Canny,Climate change makes farming easier in Alaska. Indigenous growers hope to lead the way,Climate change threatens many traditional foods in Alaska. But it’s also making farming more possible. A new training program aims to help Alaska Native communities grow more of their own food.,https://www.npr.org/2024/09/13/nx-s1-5002049/climate-change-farming-alaska-native,2024-09-13T16:01:47Z,"Climate change is affecting our food, and our food is affecting the climate. NPR is dedicating a week to stories and conversations about the search for solutions.
Growing up in rural Alaska, Eva Daw… [+8821 chars]",climate change threatens many traditional foods in alaska. but it’s also making farming more possible. a new training program aims to help alaska native communities grow more of their own food.,Neutral
NPR,Alejandra Borunda,Europe's intense rainfall in September twice as likely thanks to climate change,Extensive early warnings and years of adaptation made the floods less deadly than they otherwise might have been.,https://www.npr.org/2024/09/25/nx-s1-5123674/europes-intense-rainfall-in-september-twice-as-likely-thanks-to-climate-change,2024-09-25T09:01:00Z,"Massive rainfall inundated parts of Central and Eastern Europe in mid-September, dumping as much as two-thirds of some cities annual rain in just a few days.
The rainfall from the weather system, ca… [+5353 chars]",extensive early warnings and years of adaptation made the floods less deadly than they otherwise might have been.,Negative
The Verge,Justine Calma,The UK helped usher in the coal era — now its closing its last remaining plant,The UK plans to close its last coal-fired power plant.,https://www.theverge.com/2024/9/23/24252195/last-coal-power-plant-close-climate-change-clean-energy,2024-09-23T18:05:30Z,"The UK helped usher in the coal era now its closing its last remaining plant
The UK helped usher in the coal era now its closing its last remaining plant
 / The clock is ticking for the UKs last wo… [+3022 chars]",the uk plans to close its last coal-fired power plant.,Neutral
NPR,Clare Marie Schneider,"State bans on commercial food waste have been largely ineffective, study finds","Much of the food supply in the U.S. goes uneaten, which contributes to climate change. Some states have tried to cut food waste in landfills, but their efforts have fallen short, researchers found.",https://www.npr.org/2024/09/14/nx-s1-5112435/food-waste-bans-climate-change-study,2024-09-15T10:00:00Z,"In the U.S., more than a third of the food supply goes uneaten. The waste happens at multiple levels in the production and supply chain and is a big contributor to climate change.
Food that ends up … [+3332 chars]","much of the food supply in the u.s. goes uneaten, which contributes to climate change. some states have tried to cut food waste in landfills, but their efforts have fallen short, researchers found.",Negative
Wired,"John Timmer, Ars Technica",The UK Has No Coal-Fired Power Plants for the First Time in 142 Years,"With Monday's closure of Ratcliffe-on-Soar, coal is no longer being used to provide electricity in the UK.",https://www.wired.com/story/uk-no-coal-fired-power-plants-first-time-in-142-years/,2024-10-01T19:52:53Z,"On Monday, the UK saw the closure of its last operational coal power plant, Ratcliffe-on-Soar, which has been operating since 1968. The closure of the plant, which had a capacity of 2,000 megawatts, … [+4069 chars]","with monday's closure of ratcliffe-on-soar, coal is no longer being used to provide electricity in the uk.",Negative
Time,Rebecca Schneid and Chantelle Lee,The Biggest Moments From the TIME100 Climate Leadership Forum,"TIME convened the first-ever TIME100 Climate Leadership Forum, featuring a series of conversations focused on driving real change toward a better, more sustainable world.",https://time.com/7022337/climate-leadership-forum-biggest-moments/,2024-09-24T03:55:00Z,"Climate leaders from various fields gathered for the inaugural TIME100 Climate Leadership Forum in New York City on Monday to discuss how icons, politicians, activists, policymakers, and business lea… [+5244 chars]","time convened the first-ever time100 climate leadership forum, featuring a series of conversations focused on driving real change toward a better, more sustainable world.",Positive
Yahoo Entertainment,NA,Asheville tragedy shows there are no climate change safe havens: experts,NA,https://consent.yahoo.com/v2/collectConsent?sessionId=1_cc-session_de038120-78ce-426c-85f1-e29a874fa744,2024-10-01T00:35:00Z,"If you click 'Accept all', we and our partners, including 240 who are part of the IAB Transparency &amp; Consent Framework, will also store and/or access information on a device (in other words, use … [+678 chars]",NA,Neutral
Gizmodo.com,Adam Kovac,Chemists Finally Unravel the Mystery of Siberia’s Explosive Craters,"Underground methane blasts are behind Siberia’s puzzling exploding craters, according to new research.",https://gizmodo.com/geologists-finally-unravel-the-mystery-of-siberias-explosive-craters-2000504596,2024-09-29T14:00:11Z,"If you need one more reason to worry about warming global temperatures, you can add the ground spontaneously blowing up to the list.
In 2014, a bizarre crater was found in Siberias Yamal Peninsula. … [+3422 chars]","underground methane blasts are behind siberia’s puzzling exploding craters, according to new research.",Neutral
Wired,Julian Chokkattu,Google Is ‘Thinking Through’ How to Make the Pixel Watch Repairable,"The current version of Google's smartwatch isn't repairable, but for the first time, the company is figuring out how to fix that.",https://www.wired.com/story/google-is-thinking-through-the-pixel-watchs-design-to-be-repairable/,2024-09-24T21:56:08Z,"If you break the Google Pixel Watchwhether the first-generation smartwatch from 2022 or the latest model launched earlier this monththere is no way to repair it through official channels. Instead, if… [+3553 chars]","the current version of google's smartwatch isn't repairable, but for the first time, the company is figuring out how to fix that.",Neutral
Github.io,Christopher Krapu,Solving climate change by abusing thermodynamic scaling laws,A wintertime climate change solution,https://ckrapu.github.io/blog/2024/why-dont-we-just-freeze-the-carbon/,2024-09-29T06:17:54Z,"TL;DR: To stop climate change, just do this - raise crops for biomass (sequestering CO2) and freeze them in huge aboveground piles during winter by running pipes through the middle. With a little ins… [+18343 chars]",a wintertime climate change solution,Positive
Time,TIME PR,TIME Convenes Leaders Taking Action Toward A More Sustainable World at the Inaugural TIME100 Climate Leadership Forum,"The TIME100 Climate Leadership Forum Features Conversations with Jane Goodall, Jacinda Ardern, Michael S. Regan, Jennifer M. Granholm and More in New York City (New York, NY—September 23, 2024) Today, TIME convenes the first-ever TIME100 Climate Leadership Fo…",https://time.com/7022739/time-convenes-inaugural-time100-climate-leadership-forum/,2024-09-23T13:10:00Z,"The TIME100 Climate Leadership Forum Features Conversations with Jane Goodall, Jacinda Ardern, Michael S. Regan, Jennifer M. Granholmand More in New York City
(New York, NYSeptember 23, 2024) Today,… [+4098 chars]","the time100 climate leadership forum features conversations with jane goodall, jacinda ardern, michael s. regan, jennifer m. granholm and more in new york city (new york, ny—september 23, 2024) today, time convenes the first-ever time100 climate leadership fo…",Neutral
Gizmodo.com,Matt Novak,Belief That EVs Are Better for the Environment Drops,"Back in 2022, 63% of Americans believed EVs were greener. Now it's 58%.",https://gizmodo.com/belief-that-evs-are-better-for-the-environment-drops-2000502376,2024-09-24T15:30:59Z,"The number of Americans who believe electric vehicles are better for the environment than cars that run on fossil fuels has dipped 5% in the past two years, according to a new poll conducted by Ipsos… [+3561 chars]","back in 2022, 63% of americans believed evs were greener. now it's 58%.",Neutral
InsideClimate News,Inside Climate News,Americans misunderstand their contribution to deteriorating environment,A global survey suggests 88 percent of people are worried about the state of nature.,https://insideclimatenews.org/news/05092024/global-climate-concerns-survey/,2024-09-07T11:16:56Z,"Enlarge/ Power lines are cast in silhouette as the Creek Fire creeps up on on the Shaver Springs community off of Tollhouse Road on Tuesday, Sept. 8, 2020, in Auberry, California.
14
This article o… [+4947 chars]",a global survey suggests 88 percent of people are worried about the state of nature.,Negative
RNZ,Eloise Gibson,Great Barrier Reef already been dealt its death blow,A leading climate scientists says it's just not possible for some ecosystems to adapt to climate change.,https://www.rnz.co.nz/news/national/527469/great-barrier-reef-already-been-dealt-its-death-blow-scientist,2024-09-09T15:29:23Z,"The extensive bleaching of the Great Barrier Reef (pictured in April) was a ""death blow"" according to Dr Joëlle Gergis. Photo: DAVID GRAY / AFP
An Australian climate scientist has told a conference … [+2559 chars]",a leading climate scientists says it's just not possible for some ecosystems to adapt to climate change.,Neutral
The Verge,Justine Calma,"ExxonMobil deceived the public with plastic recycling, lawsuit claims",California filed suit against ExxonMobil after decades of promoting plastic recycling.,https://www.theverge.com/2024/9/23/24252433/exxonmobil-knew-plastic-recycling-lawsuit-california,2024-09-23T21:30:56Z,"Seal Beach, CA - December 13: Plastic bottles and other trash are piled up along the bank of the San Gabriel River just a few hundred yards from the Pacific Ocean. | Photo: Getty Images

 

 ExxonMo… [+4699 chars]",california filed suit against exxonmobil after decades of promoting plastic recycling.,Positive
BBC News,NA,Climate change leaves future of Pacific Islands tourism 'highly uncertain',Tourist sector bosses in the region are increasingly concerned about the impact of climate change.,https://www.bbc.com/news/articles/cp81l4gynljo,2024-09-08T23:33:29Z,"Tourism boss Christopher Cocker says the impact of a climate change is the ""foremost threat""
The Pacific Islands are scattered across a vast area of ocean, with some of the clearest waters in the wo… [+6484 chars]",tourist sector bosses in the region are increasingly concerned about the impact of climate change.,Neutral
BBC News,NA,Rivals try to woo the Pacific as climate change bites,"As the US, China and UK try to woo Pacific Islands for geopolitical reasons, nations are more concerned about climate.",https://www.bbc.com/news/articles/cvg5m13v9r2o,2024-09-04T21:59:40Z,"The Tongan capital Nukualofa was buzzing during the Pacific Islands Forum
Tongas sleepy capital Nukualofa was buzzing last week as leaders from across the Pacific region descended upon it for the an… [+6263 chars]","as the us, china and uk try to woo pacific islands for geopolitical reasons, nations are more concerned about climate.",Positive
